{
  "$schema": "http://json-schema.org/draft-07/schema#",
  "$id": "terminale/programme.schema.json",
  "title": "Ligne du programme officiel (terminale)",
  "description": "Une ligne du programme d'une matière de terminale, avec le texte exact du Bulletin officiel (charte terminale § 3.1). Fichier : content/terminale/<matiere>/programme.json (tableau de lignes). Le texte est contrôlé mot à mot contre le texte officiel par scripts/programme-conforme.mjs.",
  "type": "object",
  "required": ["id", "chapitre", "partie", "section", "rubrique", "exigible", "texte", "premiere"],
  "additionalProperties": false,
  "properties": {
    "id": {
      "type": "string",
      "pattern": "^bo-(m|pc|pc1)-[a-z0-9]+(-[a-z0-9]+)*-[0-9]{2,3}$",
      "description": "Identifiant stable (jamais renommé). bo-m- : maths ; bo-pc- : physique-chimie ; bo-pc1- : acquis de première de physique-chimie. Ex : bo-m-suites-07"
    },
    "chapitre": {
      "type": "string",
      "pattern": "^[a-z0-9]+(-[a-z0-9]+)*$",
      "description": "Slug du chapitre de l'année qui porte la ligne, ou methodes-<matiere> (chapitre transverse)."
    },
    "partie": {
      "type": "string",
      "minLength": 1,
      "description": "Grande partie du programme, telle que le Bulletin officiel la nomme (ex. « Analyse »)."
    },
    "section": {
      "type": "string",
      "minLength": 1,
      "description": "Section du programme, telle que le Bulletin officiel la nomme (ex. « Suites »)."
    },
    "rubrique": {
      "type": "string",
      "enum": [
        "contenu",
        "capacite",
        "demonstration",
        "algorithme",
        "experimentale",
        "numerique",
        "mathematique",
        "approfondissement"
      ],
      "description": "Rubrique du programme d'où vient la ligne : contenus, capacités attendues, démonstrations, exemples d'algorithme, capacités expérimentales, numériques ou mathématiques, approfondissements possibles."
    },
    "exigible": {
      "type": "boolean",
      "description": "false pour ce que le programme présente comme non exigible (approfondissements possibles) : jamais exigé par la couverture."
    },
    "texte": {
      "type": "string",
      "minLength": 3,
      "description": "Texte exact du Bulletin officiel, jamais reformulé ; les expressions mathématiques en LaTeX KaTeX ($…$)."
    },
    "premiere": {
      "type": "boolean",
      "description": "true pour un acquis de première mobilisable (bo-pc1-…) : jamais exigé par la couverture, cité par les blocs « rappel »."
    }
  },
  "allOf": [
    {
      "if": { "properties": { "rubrique": { "const": "approfondissement" } } },
      "then": { "properties": { "exigible": { "const": false } } }
    },
    {
      "if": { "properties": { "premiere": { "const": true } } },
      "then": { "properties": { "id": { "pattern": "^bo-pc1-" } } }
    }
  ]
}
