[
  {
    "id": "bo-m-temoin-01",
    "chapitre": "temoin-maths",
    "partie": "Témoin",
    "section": "Section d'essai",
    "rubrique": "capacite",
    "exigible": true,
    "texte": "Ligne d'essai bo-m-temoin-01 — rubrique « capacite » (chapitre-témoin : donnée d'essai, pas un texte officiel).",
    "premiere": false
  },
  {
    "id": "bo-m-temoin-02",
    "chapitre": "temoin-maths",
    "partie": "Témoin",
    "section": "Section d'essai",
    "rubrique": "demonstration",
    "exigible": true,
    "texte": "Ligne d'essai bo-m-temoin-02 — rubrique « demonstration » (chapitre-témoin : donnée d'essai, pas un texte officiel).",
    "premiere": false
  },
  {
    "id": "bo-m-temoin-03",
    "chapitre": "temoin-maths",
    "partie": "Témoin",
    "section": "Section d'essai",
    "rubrique": "contenu",
    "exigible": true,
    "texte": "Ligne d'essai bo-m-temoin-03 — rubrique « contenu » (chapitre-témoin : donnée d'essai, pas un texte officiel).",
    "premiere": false
  },
  {
    "id": "bo-m-temoin-04",
    "chapitre": "temoin-maths",
    "partie": "Témoin",
    "section": "Section d'essai",
    "rubrique": "algorithme",
    "exigible": true,
    "texte": "Ligne d'essai bo-m-temoin-04 — rubrique « algorithme » (chapitre-témoin : donnée d'essai, pas un texte officiel).",
    "premiere": false
  },
  {
    "id": "bo-m-temoin-05",
    "chapitre": "temoin-maths",
    "partie": "Témoin",
    "section": "Section d'essai",
    "rubrique": "capacite",
    "exigible": true,
    "texte": "Ligne d'essai bo-m-temoin-05 — rubrique « capacite » (chapitre-témoin : donnée d'essai, pas un texte officiel).",
    "premiere": false
  },
  {
    "id": "bo-m-temoin-06",
    "chapitre": "temoin-maths",
    "partie": "Témoin",
    "section": "Section d'essai",
    "rubrique": "approfondissement",
    "exigible": false,
    "texte": "Ligne d'essai bo-m-temoin-06 — rubrique « approfondissement » (chapitre-témoin : donnée d'essai, pas un texte officiel).",
    "premiere": false
  },
  {
    "id": "bo-m-temoin-methodes-01",
    "chapitre": "temoin-methodes-maths",
    "partie": "Témoin",
    "section": "Logique (essai)",
    "rubrique": "capacite",
    "exigible": true,
    "texte": "Ligne d'essai bo-m-temoin-methodes-01 — rubrique « capacite » (chapitre-témoin : donnée d'essai, pas un texte officiel).",
    "premiere": false
  },
  {
    "id": "bo-m-temoin-methodes-02",
    "chapitre": "temoin-methodes-maths",
    "partie": "Témoin",
    "section": "Algorithmique (essai)",
    "rubrique": "algorithme",
    "exigible": true,
    "texte": "Ligne d'essai bo-m-temoin-methodes-02 — rubrique « algorithme » (chapitre-témoin : donnée d'essai, pas un texte officiel).",
    "premiere": false
  },
  {
    "id": "bo-m-temoin-methodes-03",
    "chapitre": "temoin-methodes-maths",
    "partie": "Témoin",
    "section": "Rédaction (essai)",
    "rubrique": "capacite",
    "exigible": true,
    "texte": "Ligne d'essai bo-m-temoin-methodes-03 — rubrique « capacite » (chapitre-témoin : donnée d'essai, pas un texte officiel).",
    "premiere": false
  }
]
